{
  "documentId": "template-strength-assessment",
  "documentType": "Template",
  "schemaRef": "TemplateSchema/v1",
  "templateKind": "judgment",
  "skillRef": "qa-advisor",
  "status": "DRAFT",
  "content": {
    "title": {
      "blockType": "Title",
      "title": "template-strength-assessment"
    },
    "trigger": {
      "blockType": "Trigger",
      "title": "使用条件",
      "text": "「このテストは弱くないか」「実装をなぞっているだけでは」等、既存テスト・シナリオの品質評価を求める相談",
      "openingLine": "{{対象（ユーザーが提示したテストコード・シナリオ）}}を評価します。"
    },
    "contextBlocks": {
      "blockType": "ContextBlocks",
      "title": "前置きセクション",
      "items": [],
      "emptyReason": "テスト強度評価は前提となる分類・階層の確認を必要とせず、診断フローから直接始めるため。"
    },
    "diagnosticFlow": {
      "blockType": "DiagnosticFlow",
      "title": "診断フロー",
      "items": [
        {
          "questionId": "q1",
          "question": "カバレッジは通っているが、アサーションが対象の振る舞いを実際に検証しているか。",
          "branches": [
            {
              "condition": "YES（検証している）",
              "then": "次へ"
            },
            {
              "condition": "NO（実行されているだけで何も検証していない、または些細な値しか検証していない）",
              "then": "**空疎なテスト（カバレッジ駆動テスト）に該当**"
            }
          ]
        },
        {
          "questionId": "q2",
          "question": "テストが実装の詳細（内部構造・呼び出し順序等）に依存しているか、それとも振る舞い（入出力）だけを検証しているか。",
          "branches": [
            {
              "condition": "振る舞いのみを検証",
              "then": "良好"
            },
            {
              "condition": "実装の詳細に依存",
              "then": "**実装をなぞる脆いテストに該当（test smellsの観点で分類する）**"
            }
          ]
        },
        {
          "questionId": "q3",
          "question": "協調オブジェクト（collaborator）をtest doubleで置き換えているか、実際に動かしているか。",
          "branches": [
            {
              "condition": "置き換えている（solitary）",
              "then": "その孤立が本当に必要か（協調オブジェクトが重い・遅い・副作用があるか）を確認する"
            },
            {
              "condition": "実際に動かしている（sociable）",
              "then": "協調オブジェクトの不具合でこのテストが道連れで失敗するリスクを許容できるか確認する"
            }
          ]
        }
      ]
    },
    "verdict": {
      "blockType": "Verdict",
      "title": "判定",
      "guidance": "「{{対象}}は「{{弱い／良好}}」です。」と明示した上で、{{該当するknowledgeファイル（test-smells.md／sociable-solitary-unit-tests.md／mutation-testing.md）の定義・分類名を引用しつつ、判定理由を2〜3文で説明する}}"
    },
    "recommendedAction": {
      "blockType": "RecommendedAction",
      "title": "推奨アクション",
      "guidance": "{{具体的に何を直すべきかを動詞で始める（例: アサーションを対象の振る舞いに即した値に変更する）}}。{{mutation testingが利用可能なら、該当箇所にmutantを注入して実際にkillできるか確認することを提案してもよい}}"
    },
    "extraSections": {
      "blockType": "ExtraSections",
      "title": "追加セクション",
      "items": [
        {
          "title": "診断的差し戻し（該当する場合のみ）",
          "guidance": "{{弱さの原因がテスト自体の執筆品質ではなく、上流の設計判断（サブドメイン分類とテスト比率の不一致=ddd-advisor領域、テスト容易性の低さ=tech-lead-advisor領域）に起因する疑いがある場合、断定せずその可能性を明示する}}"
        }
      ],
      "emptyReason": ""
    },
    "antiPatternNote": {
      "blockType": "AntiPatternNote",
      "title": "注意（アンチパターンに該当する場合のみ）",
      "guidance": "{{該当するtest smell名}}: {{なぜそれが問題なのかとリスクを説明。test-induced design damageに触れる場合は、DHH側/Beck・Fowler側の対立する立場を両論併記し、一方が絶対的に正しいと断定しない}}"
    }
  },
  "tags": []
}